{
  "$schema": "https://json-schema.org/draft/2020-12/schema",
  "$id": "https://github.com/nulleimy/HOWEDO/schemas/consumer-trust-v1/consumer-trust-profile.schema.json",
  "title": "HOWEDO Consumer Trust Profile v1",
  "type": "object",
  "additionalProperties": false,
  "required": [
    "allowed_crypto_verifiers",
    "allowed_identity_patterns",
    "allowed_issuers",
    "allowed_ref_patterns",
    "allowed_repositories",
    "allowed_triggers",
    "allowed_workflows",
    "expected_workflow_name",
    "profile_digest",
    "profile_id",
    "profile_version",
    "require_transparency_log",
    "trusted_policies",
    "trusted_svr_verifier_ids"
  ],
  "properties": {
    "profile_version": {"const": "howedo.consumer-trust-profile.v1"},
    "profile_id": {"type": "string", "minLength": 1},
    "profile_digest": {"type": "string", "pattern": "^sha256:[0-9a-f]{64}$"},
    "expected_workflow_name": {"type": "string", "minLength": 1},
    "trusted_svr_verifier_ids": {"$ref": "#/$defs/nonEmptyStrings"},
    "trusted_policies": {
      "type": "array",
      "minItems": 1,
      "uniqueItems": true,
      "items": {
        "type": "object",
        "additionalProperties": false,
        "required": ["policy_id", "policy_digest"],
        "properties": {
          "policy_id": {"type": "string", "minLength": 1},
          "policy_digest": {"type": "string", "pattern": "^sha256:[0-9a-f]{64}$"}
        }
      }
    },
    "allowed_crypto_verifiers": {"$ref": "#/$defs/nonEmptyStrings"},
    "allowed_issuers": {"$ref": "#/$defs/nonEmptyStrings"},
    "allowed_identity_patterns": {"$ref": "#/$defs/nonEmptyStrings"},
    "allowed_repositories": {"$ref": "#/$defs/nonEmptyStrings"},
    "allowed_workflows": {"$ref": "#/$defs/nonEmptyStrings"},
    "allowed_ref_patterns": {"$ref": "#/$defs/nonEmptyStrings"},
    "allowed_triggers": {"$ref": "#/$defs/nonEmptyStrings"},
    "require_transparency_log": {"type": "boolean"}
  },
  "$defs": {
    "nonEmptyStrings": {
      "type": "array",
      "minItems": 1,
      "uniqueItems": true,
      "items": {"type": "string", "minLength": 1}
    }
  }
}
